{
  "schemaVersion": 1,
  "contractId": "0x801b3b82932299be2bbb18babd123a87a2aa20c064fc49a1d23defa7658b3e78",
  "operator": "0xf39Fd6e51aad88F6F4ce6aB8827279cffFb92266",
  "actionTemplate": {
    "tool": "cloud",
    "action": "ssmPutParameter"
  },
  "resourceScope": {
    "type": "cloud-resource",
    "descriptor": {
      "accountId": "123456789012",
      "region": "us-east-1",
      "resourceArn": "arn:aws:ssm:us-east-1:123456789012:parameter/prod/api/*",
      "pathPrefix": "/prod/api/"
    }
  },
  "effectClass": "compensable",
  "recoveryOperator": {
    "compensatorId": "cloud.ssm.priorVersion.restore.v1",
    "freshnessSeconds": 600,
    "retentionSeconds": 2592000,
    "authPolicyHash": "0xaaaa000000000000000000000000000000000000000000000000000000000104"
  },
  "coveredLossClass": {
    "codes": ["downtime_seconds", "manual_recovery_effort", "excess_spend_usd"],
    "excludeList": ["data_exfiltration", "public_disclosure", "physical_action", "uncapped_downstream"]
  },
  "payoutRule": {
    "type": "rowCountSchedule",
    "params": {
      "perRowUsd": "2.50",
      "minPayoutUsd": "10.00"
    },
    "maxPayout": "1500000000"
  },
  "bond": {
    "asset": "0xe7f1725E7734CE288F8367e1Bb143E90bb3F0512",
    "minAmount": "15000000000",
    "maxAggregateExposure": "15000000000"
  },
  "evidenceSchema": {
    "schemaId": "0xbbbb000000000000000000000000000000000000000000000000000000000104",
    "requiredProvenance": "L1",
    "accessPolicyHash": "0xcccc000000000000000000000000000000000000000000000000000000000104"
  },
  "deadlines": {
    "recoverySeconds": 900,
    "submissionSeconds": 86400,
    "livenessSeconds": 21600
  },
  "disputeRoute": {
    "arbitrator": "0x5FC8d32690cc91D4c39d9d3abcBD16989F875707",
    "evidenceGroupId": "1104"
  }
}
