{
  "schemaVersion": 1,
  "contractId": "0xa5bba3473a5ce3271dab19fe202f2a90ee7f3a4a68ae20d54c68e7a542d0c9f5",
  "operator": "0xf39Fd6e51aad88F6F4ce6aB8827279cffFb92266",
  "actionTemplate": {
    "tool": "git",
    "action": "forcePush"
  },
  "resourceScope": {
    "type": "git-ref",
    "descriptor": {
      "repoUrl": "https://git.example.com/tenant/repo.git",
      "ref": "refs/heads/*",
      "branchPattern": "refs/heads/!(main|master|release/*)"
    }
  },
  "effectClass": "compensable",
  "recoveryOperator": {
    "compensatorId": "git.reflog.restore.v1",
    "freshnessSeconds": 7200,
    "retentionSeconds": 604800,
    "authPolicyHash": "0xaaaa000000000000000000000000000000000000000000000000000000000103"
  },
  "coveredLossClass": {
    "codes": ["history_bytes_lost", "manual_recovery_effort"],
    "excludeList": ["data_exfiltration", "public_disclosure", "irreversible_transfer", "uncapped_downstream"]
  },
  "payoutRule": {
    "type": "composite",
    "params": {
      "components": [
        {
          "type": "rowCountSchedule",
          "weight": 1,
          "params": { "perRowUsd": "0.50", "minPayoutUsd": "10.00" }
        }
      ]
    },
    "maxPayout": "500000000"
  },
  "bond": {
    "asset": "0xe7f1725E7734CE288F8367e1Bb143E90bb3F0512",
    "minAmount": "5000000000",
    "maxAggregateExposure": "5000000000"
  },
  "evidenceSchema": {
    "schemaId": "0xbbbb000000000000000000000000000000000000000000000000000000000103",
    "requiredProvenance": "L2",
    "accessPolicyHash": "0xcccc000000000000000000000000000000000000000000000000000000000103"
  },
  "deadlines": {
    "recoverySeconds": 3600,
    "submissionSeconds": 172800,
    "livenessSeconds": 21600
  },
  "disputeRoute": {
    "arbitrator": "0x5FC8d32690cc91D4c39d9d3abcBD16989F875707",
    "evidenceGroupId": "1103"
  }
}
